{
  "$schema": "https://json-schema.org/draft/2020-12/schema",
  "$id": "urn:asimov:0.2.0:assessment-report",
  "title": "Asimov assessment report",
  "description": "Schema validation is structural only; evidence and identity need separate verification.",
  "type": "object",
  "properties": {
    "spec_version": {
      "const": "0.2.0"
    },
    "catalog_version": {
      "const": "0.2.0"
    },
    "report_id": {
      "type": "string",
      "minLength": 1
    },
    "created_at": {
      "type": "string",
      "format": "date-time"
    },
    "assessment": {
      "type": "object",
      "properties": {
        "mode": {
          "enum": [
            "illustrative",
            "self_assessment",
            "independent_assessment"
          ]
        },
        "assessor": {
          "type": "string",
          "minLength": 1
        }
      },
      "required": [
        "mode",
        "assessor"
      ],
      "additionalProperties": false
    },
    "system": {
      "type": "object",
      "properties": {
        "id": {
          "type": "string",
          "minLength": 1
        },
        "configuration_sha256": {
          "type": "string",
          "pattern": "^[a-f0-9]{64}$"
        }
      },
      "required": [
        "id",
        "configuration_sha256"
      ],
      "additionalProperties": false
    },
    "scope_manifest_sha256": {
      "type": "string",
      "pattern": "^[a-f0-9]{64}$"
    },
    "requested_profile": {
      "enum": [
        "A0",
        "A1",
        "A2",
        "A3",
        "A4",
        "A5"
      ]
    },
    "preconditions": {
      "type": "object",
      "properties": {
        "deployment_binding": {
          "type": "object",
          "properties": {
            "status": {
              "enum": [
                "PASS",
                "FAIL",
                "ERROR",
                "NOT_TESTED",
                "INCONCLUSIVE",
                "NOT_APPLICABLE"
              ]
            },
            "reason": {
              "type": "string",
              "minLength": 1
            },
            "evidence_refs": {
              "type": "array",
              "items": {
                "type": "string",
                "minLength": 1
              }
            }
          },
          "required": [
            "status",
            "reason",
            "evidence_refs"
          ],
          "additionalProperties": false,
          "allOf": [
            {
              "if": {
                "properties": {
                  "status": {
                    "const": "PASS"
                  }
                }
              },
              "then": {
                "properties": {
                  "evidence_refs": {
                    "minItems": 1
                  }
                }
              }
            }
          ]
        },
        "boundary_review": {
          "type": "object",
          "properties": {
            "status": {
              "enum": [
                "PASS",
                "FAIL",
                "ERROR",
                "NOT_TESTED",
                "INCONCLUSIVE",
                "NOT_APPLICABLE"
              ]
            },
            "reason": {
              "type": "string",
              "minLength": 1
            },
            "evidence_refs": {
              "type": "array",
              "items": {
                "type": "string",
                "minLength": 1
              }
            }
          },
          "required": [
            "status",
            "reason",
            "evidence_refs"
          ],
          "additionalProperties": false,
          "allOf": [
            {
              "if": {
                "properties": {
                  "status": {
                    "const": "PASS"
                  }
                }
              },
              "then": {
                "properties": {
                  "evidence_refs": {
                    "minItems": 1
                  }
                }
              }
            }
          ]
        },
        "timing_plan": {
          "type": "object",
          "properties": {
            "status": {
              "enum": [
                "PASS",
                "FAIL",
                "ERROR",
                "NOT_TESTED",
                "INCONCLUSIVE",
                "NOT_APPLICABLE"
              ]
            },
            "reason": {
              "type": "string",
              "minLength": 1
            },
            "evidence_refs": {
              "type": "array",
              "items": {
                "type": "string",
                "minLength": 1
              }
            }
          },
          "required": [
            "status",
            "reason",
            "evidence_refs"
          ],
          "additionalProperties": false,
          "allOf": [
            {
              "if": {
                "properties": {
                  "status": {
                    "const": "PASS"
                  }
                }
              },
              "then": {
                "properties": {
                  "evidence_refs": {
                    "minItems": 1
                  }
                }
              }
            }
          ]
        },
        "positive_controls": {
          "type": "object",
          "properties": {
            "status": {
              "enum": [
                "PASS",
                "FAIL",
                "ERROR",
                "NOT_TESTED",
                "INCONCLUSIVE",
                "NOT_APPLICABLE"
              ]
            },
            "reason": {
              "type": "string",
              "minLength": 1
            },
            "evidence_refs": {
              "type": "array",
              "items": {
                "type": "string",
                "minLength": 1
              }
            }
          },
          "required": [
            "status",
            "reason",
            "evidence_refs"
          ],
          "additionalProperties": false,
          "allOf": [
            {
              "if": {
                "properties": {
                  "status": {
                    "const": "PASS"
                  }
                }
              },
              "then": {
                "properties": {
                  "evidence_refs": {
                    "minItems": 1
                  }
                }
              }
            }
          ]
        },
        "evidence_review": {
          "type": "object",
          "properties": {
            "status": {
              "enum": [
                "PASS",
                "FAIL",
                "ERROR",
                "NOT_TESTED",
                "INCONCLUSIVE",
                "NOT_APPLICABLE"
              ]
            },
            "reason": {
              "type": "string",
              "minLength": 1
            },
            "evidence_refs": {
              "type": "array",
              "items": {
                "type": "string",
                "minLength": 1
              }
            }
          },
          "required": [
            "status",
            "reason",
            "evidence_refs"
          ],
          "additionalProperties": false,
          "allOf": [
            {
              "if": {
                "properties": {
                  "status": {
                    "const": "PASS"
                  }
                }
              },
              "then": {
                "properties": {
                  "evidence_refs": {
                    "minItems": 1
                  }
                }
              }
            }
          ]
        },
        "adversarial_assurance_plan": {
          "type": "object",
          "properties": {
            "status": {
              "enum": [
                "PASS",
                "FAIL",
                "ERROR",
                "NOT_TESTED",
                "INCONCLUSIVE",
                "NOT_APPLICABLE"
              ]
            },
            "reason": {
              "type": "string",
              "minLength": 1
            },
            "evidence_refs": {
              "type": "array",
              "items": {
                "type": "string",
                "minLength": 1
              }
            }
          },
          "required": [
            "status",
            "reason",
            "evidence_refs"
          ],
          "additionalProperties": false,
          "allOf": [
            {
              "if": {
                "properties": {
                  "status": {
                    "const": "PASS"
                  }
                }
              },
              "then": {
                "properties": {
                  "evidence_refs": {
                    "minItems": 1
                  }
                }
              }
            }
          ]
        },
        "common_mode_failure_analysis": {
          "type": "object",
          "properties": {
            "status": {
              "enum": [
                "PASS",
                "FAIL",
                "ERROR",
                "NOT_TESTED",
                "INCONCLUSIVE",
                "NOT_APPLICABLE"
              ]
            },
            "reason": {
              "type": "string",
              "minLength": 1
            },
            "evidence_refs": {
              "type": "array",
              "items": {
                "type": "string",
                "minLength": 1
              }
            }
          },
          "required": [
            "status",
            "reason",
            "evidence_refs"
          ],
          "additionalProperties": false,
          "allOf": [
            {
              "if": {
                "properties": {
                  "status": {
                    "const": "PASS"
                  }
                }
              },
              "then": {
                "properties": {
                  "evidence_refs": {
                    "minItems": 1
                  }
                }
              }
            }
          ]
        },
        "recovery_exercise": {
          "type": "object",
          "properties": {
            "status": {
              "enum": [
                "PASS",
                "FAIL",
                "ERROR",
                "NOT_TESTED",
                "INCONCLUSIVE",
                "NOT_APPLICABLE"
              ]
            },
            "reason": {
              "type": "string",
              "minLength": 1
            },
            "evidence_refs": {
              "type": "array",
              "items": {
                "type": "string",
                "minLength": 1
              }
            }
          },
          "required": [
            "status",
            "reason",
            "evidence_refs"
          ],
          "additionalProperties": false,
          "allOf": [
            {
              "if": {
                "properties": {
                  "status": {
                    "const": "PASS"
                  }
                }
              },
              "then": {
                "properties": {
                  "evidence_refs": {
                    "minItems": 1
                  }
                }
              }
            }
          ]
        },
        "critical_effect_inventory": {
          "type": "object",
          "properties": {
            "status": {
              "enum": [
                "PASS",
                "FAIL",
                "ERROR",
                "NOT_TESTED",
                "INCONCLUSIVE",
                "NOT_APPLICABLE"
              ]
            },
            "reason": {
              "type": "string",
              "minLength": 1
            },
            "evidence_refs": {
              "type": "array",
              "items": {
                "type": "string",
                "minLength": 1
              }
            }
          },
          "required": [
            "status",
            "reason",
            "evidence_refs"
          ],
          "additionalProperties": false,
          "allOf": [
            {
              "if": {
                "properties": {
                  "status": {
                    "const": "PASS"
                  }
                }
              },
              "then": {
                "properties": {
                  "evidence_refs": {
                    "minItems": 1
                  }
                }
              }
            }
          ]
        },
        "domain_safety_case": {
          "type": "object",
          "properties": {
            "status": {
              "enum": [
                "PASS",
                "FAIL",
                "ERROR",
                "NOT_TESTED",
                "INCONCLUSIVE",
                "NOT_APPLICABLE"
              ]
            },
            "reason": {
              "type": "string",
              "minLength": 1
            },
            "evidence_refs": {
              "type": "array",
              "items": {
                "type": "string",
                "minLength": 1
              }
            }
          },
          "required": [
            "status",
            "reason",
            "evidence_refs"
          ],
          "additionalProperties": false,
          "allOf": [
            {
              "if": {
                "properties": {
                  "status": {
                    "const": "PASS"
                  }
                }
              },
              "then": {
                "properties": {
                  "evidence_refs": {
                    "minItems": 1
                  }
                }
              }
            }
          ]
        },
        "independent_review_plan": {
          "type": "object",
          "properties": {
            "status": {
              "enum": [
                "PASS",
                "FAIL",
                "ERROR",
                "NOT_TESTED",
                "INCONCLUSIVE",
                "NOT_APPLICABLE"
              ]
            },
            "reason": {
              "type": "string",
              "minLength": 1
            },
            "evidence_refs": {
              "type": "array",
              "items": {
                "type": "string",
                "minLength": 1
              }
            }
          },
          "required": [
            "status",
            "reason",
            "evidence_refs"
          ],
          "additionalProperties": false,
          "allOf": [
            {
              "if": {
                "properties": {
                  "status": {
                    "const": "PASS"
                  }
                }
              },
              "then": {
                "properties": {
                  "evidence_refs": {
                    "minItems": 1
                  }
                }
              }
            }
          ]
        }
      },
      "required": [],
      "additionalProperties": false
    },
    "results": {
      "type": "array",
      "items": {
        "type": "object",
        "properties": {
          "status": {
            "enum": [
              "PASS",
              "FAIL",
              "ERROR",
              "NOT_TESTED",
              "INCONCLUSIVE",
              "NOT_APPLICABLE"
            ]
          },
          "reason": {
            "type": "string",
            "minLength": 1
          },
          "evidence_refs": {
            "type": "array",
            "items": {
              "type": "string",
              "minLength": 1
            }
          },
          "requirement_id": {
            "enum": [
              "OBS-001",
              "OBS-002",
              "OBS-003",
              "OBS-004",
              "MED-001",
              "MED-002",
              "MED-003",
              "MED-004",
              "REV-001",
              "REV-002",
              "REV-003",
              "REV-004",
              "OVR-001",
              "OVR-002",
              "OVR-003",
              "OVR-004",
              "DEL-001",
              "DEL-002",
              "DEL-003",
              "DEL-004",
              "HUM-001",
              "HUM-002",
              "HUM-003",
              "HUM-004",
              "ACC-001",
              "ACC-002",
              "ACC-003",
              "ACC-004",
              "OBS-005",
              "MED-005",
              "REV-005",
              "OVR-005",
              "DEL-005",
              "HUM-005",
              "ACC-005",
              "OBS-006",
              "MED-006",
              "REV-006",
              "OVR-006",
              "DEL-006",
              "HUM-006",
              "ACC-006"
            ]
          }
        },
        "required": [
          "status",
          "reason",
          "evidence_refs",
          "requirement_id"
        ],
        "additionalProperties": false,
        "allOf": [
          {
            "if": {
              "properties": {
                "status": {
                  "const": "PASS"
                }
              }
            },
            "then": {
              "properties": {
                "evidence_refs": {
                  "minItems": 1
                }
              }
            }
          }
        ]
      }
    },
    "limitations": {
      "type": "array",
      "items": {
        "type": "string",
        "minLength": 1
      }
    }
  },
  "required": [
    "spec_version",
    "catalog_version",
    "report_id",
    "created_at",
    "assessment",
    "system",
    "scope_manifest_sha256",
    "requested_profile",
    "preconditions",
    "results",
    "limitations"
  ],
  "additionalProperties": false
}
